{
  "id": "event-1",
  "session_id": "20000000-0000-4000-8000-000000000001",
  "pane_id": 7,
  "ordering_key": "2026-08-08T12:01:00.000000000Z:event-1",
  "created_at": "2026-08-08T12:01:00Z",
  "kind": "test",
  "summary": "All tests passed",
  "requires_attention": false,
  "detail": { "passed": 42, "failed": 0 }
}
